{
  "contract_name": "VerificationResult",
  "contract_version": "0.1",
  "run": {
    "run_id": "run-1791121366",
    "origin": "engine3_pipeline",
    "started_at": null,
    "finished_at": null,
    "git_sha": null,
    "mode": "offline_fixture",
    "simulator_backend": "local_evaluator",
    "sandbox_mode": "none",
    "enrichment": "off"
  },
  "inputs": {
    "iamgraph_snapshot_id": "ENGINE3-DRAFT-FIXTURE-0001",
    "iamgraph_content_sha256": "22685f5a32abe39f3ffc42d915d2102f42a04acfd186a907f603e8bc6ee551ea",
    "iamgraph_collection_status": "complete",
    "rulebook_sha256": "56dfee1734c8f5827b0cfed707a354466cac60f506612816ebca0cf8c89c64e2",
    "rulebook_origin": "active",
    "rules_active": 12,
    "rules_skipped": 0
  },
  "degraded": false,
  "degraded_reasons": [],
  "paths": [
    {
      "path_id": "1997ec24d1dc01f7",
      "status": "SANDBOX_FAILED",
      "status_reason": "Sandbox execution unconfirmed (offline mode).",
      "verification_scope": "offline_fixture",
      "hops": [
        {
          "from_node": "arn:aws:iam::111122223333:user/dev-alice",
          "to_node": "arn:aws:iam::111122223333:role/DeployRole",
          "action_used": "sts:AssumeRole",
          "matched_rule_id": null,
          "edge_id": "edge:TRUSTED_BY:04",
          "edge_type": "TRUSTED_BY",
          "flags": [
            "condition_unevaluated"
          ]
        },
        {
          "from_node": "arn:aws:iam::111122223333:role/DeployRole",
          "to_node": "arn:aws:secretsmanager:us-east-1:111122223333:secret:prod/db-password-AbCdEf",
          "action_used": "rule_target:RULE-IAM-003",
          "matched_rule_id": "RULE-IAM-003",
          "edge_id": "edge:APPLIES_TO:05",
          "edge_type": "APPLIES_TO",
          "flags": [
            "deny_present"
          ]
        }
      ],
      "assumptions": [
        "condition_unevaluated",
        "deny_present"
      ],
      "queue_rank": 1,
      "queue_reason": "severity CRITICAL, 2 hops, 2 assumptions",
      "evidence": {
        "policy_simulator_result": "ALLOWED",
        "policy_simulator_source": "local_evaluator",
        "policy_simulator_details": [
          {
            "hop_index": 0,
            "decision": "ALLOWED",
            "eval_decision": "allowed",
            "missing_context": [],
            "note": "Trust checked structurally, simulator does not evaluate trust policies",
            "raw_ref": null
          },
          {
            "hop_index": 1,
            "decision": "ALLOWED",
            "eval_decision": "allowed",
            "missing_context": [],
            "note": "",
            "raw_ref": null
          }
        ],
        "sandbox_scenario_name": null,
        "sandbox_attempted": false,
        "sandbox_execution_success": null,
        "sandbox_logs": [],
        "sandbox_logs_redacted": true,
        "sandbox_evidence_ref": null
      },
      "limitations": [
        "local_evaluator, not AWS",
        "Permissions boundaries beyond ARN not checked",
        "SCP/RCP/session policies not evaluated",
        "Offline local evaluation, not independent verification",
        "SCP/RCP/Resource policies not evaluated"
      ],
      "runtime_metrics": {
        "policy_sim_time_ms": 2.0012855529785156,
        "sandbox_time_ms": 0.0
      }
    },
    {
      "path_id": "33ba008c77e4be2c",
      "status": "SANDBOX_FAILED",
      "status_reason": "Sandbox execution unconfirmed (offline mode).",
      "verification_scope": "offline_fixture",
      "hops": [
        {
          "from_node": "arn:aws:iam::111122223333:user/dev-alice",
          "to_node": "arn:aws:iam::111122223333:role/DeployRole",
          "action_used": "rule_target:RULE-IAM-002",
          "matched_rule_id": "RULE-IAM-002",
          "edge_id": "edge:APPLIES_TO:03",
          "edge_type": "APPLIES_TO",
          "flags": [
            "condition_unevaluated"
          ]
        },
        {
          "from_node": "arn:aws:iam::111122223333:role/DeployRole",
          "to_node": "arn:aws:secretsmanager:us-east-1:111122223333:secret:prod/db-password-AbCdEf",
          "action_used": "rule_target:RULE-IAM-003",
          "matched_rule_id": "RULE-IAM-003",
          "edge_id": "edge:APPLIES_TO:05",
          "edge_type": "APPLIES_TO",
          "flags": [
            "deny_present"
          ]
        }
      ],
      "assumptions": [
        "condition_unevaluated",
        "deny_present"
      ],
      "queue_rank": 2,
      "queue_reason": "severity CRITICAL, 2 hops, 2 assumptions",
      "evidence": {
        "policy_simulator_result": "ALLOWED",
        "policy_simulator_source": "local_evaluator",
        "policy_simulator_details": [
          {
            "hop_index": 0,
            "decision": "ALLOWED",
            "eval_decision": "allowed",
            "missing_context": [],
            "note": "",
            "raw_ref": null
          },
          {
            "hop_index": 1,
            "decision": "ALLOWED",
            "eval_decision": "allowed",
            "missing_context": [],
            "note": "",
            "raw_ref": null
          }
        ],
        "sandbox_scenario_name": null,
        "sandbox_attempted": false,
        "sandbox_execution_success": null,
        "sandbox_logs": [],
        "sandbox_logs_redacted": true,
        "sandbox_evidence_ref": null
      },
      "limitations": [
        "local_evaluator, not AWS",
        "Permissions boundaries beyond ARN not checked",
        "SCP/RCP/session policies not evaluated",
        "Offline local evaluation, not independent verification",
        "SCP/RCP/Resource policies not evaluated"
      ],
      "runtime_metrics": {
        "policy_sim_time_ms": 2.0012855529785156,
        "sandbox_time_ms": 0.0
      }
    },
    {
      "path_id": "2c14c5d11f78ef5e",
      "status": "SANDBOX_FAILED",
      "status_reason": "Sandbox execution unconfirmed (offline mode).",
      "verification_scope": "offline_fixture",
      "hops": [
        {
          "from_node": "arn:aws:iam::111122223333:user/dev-alice",
          "to_node": "arn:aws:iam::111122223333:role/DevRole",
          "action_used": "rule_target:RULE-IAM-011",
          "matched_rule_id": "RULE-IAM-011",
          "edge_id": "edge:APPLIES_TO:01",
          "edge_type": "APPLIES_TO",
          "flags": []
        },
        {
          "from_node": "arn:aws:iam::111122223333:role/DevRole",
          "to_node": "arn:aws:iam::111122223333:role/DeployRole",
          "action_used": "rule_target:RULE-IAM-010",
          "matched_rule_id": "RULE-IAM-010",
          "edge_id": "edge:APPLIES_TO:04",
          "edge_type": "APPLIES_TO",
          "flags": []
        },
        {
          "from_node": "arn:aws:iam::111122223333:role/DeployRole",
          "to_node": "arn:aws:secretsmanager:us-east-1:111122223333:secret:prod/db-password-AbCdEf",
          "action_used": "rule_target:RULE-IAM-003",
          "matched_rule_id": "RULE-IAM-003",
          "edge_id": "edge:APPLIES_TO:05",
          "edge_type": "APPLIES_TO",
          "flags": [
            "deny_present"
          ]
        }
      ],
      "assumptions": [
        "deny_present"
      ],
      "queue_rank": 3,
      "queue_reason": "severity CRITICAL, 3 hops, 1 assumption",
      "evidence": {
        "policy_simulator_result": "ALLOWED",
        "policy_simulator_source": "local_evaluator",
        "policy_simulator_details": [
          {
            "hop_index": 0,
            "decision": "ALLOWED",
            "eval_decision": "allowed",
            "missing_context": [],
            "note": "",
            "raw_ref": null
          },
          {
            "hop_index": 1,
            "decision": "ALLOWED",
            "eval_decision": "allowed",
            "missing_context": [],
            "note": "",
            "raw_ref": null
          },
          {
            "hop_index": 2,
            "decision": "ALLOWED",
            "eval_decision": "allowed",
            "missing_context": [],
            "note": "",
            "raw_ref": null
          }
        ],
        "sandbox_scenario_name": null,
        "sandbox_attempted": false,
        "sandbox_execution_success": null,
        "sandbox_logs": [],
        "sandbox_logs_redacted": true,
        "sandbox_evidence_ref": null
      },
      "limitations": [
        "local_evaluator, not AWS",
        "Permissions boundaries beyond ARN not checked",
        "SCP/RCP/session policies not evaluated",
        "Offline local evaluation, not independent verification",
        "SCP/RCP/Resource policies not evaluated"
      ],
      "runtime_metrics": {
        "policy_sim_time_ms": 2.0012855529785156,
        "sandbox_time_ms": 0.0
      }
    },
    {
      "path_id": "0bfd4cb155f497ae",
      "status": "SANDBOX_FAILED",
      "status_reason": "Sandbox execution unconfirmed (offline mode).",
      "verification_scope": "offline_fixture",
      "hops": [
        {
          "from_node": "arn:aws:iam::111122223333:user/dev-alice",
          "to_node": "arn:aws:iam::111122223333:role/DevRole",
          "action_used": "rule_target:RULE-IAM-011",
          "matched_rule_id": "RULE-IAM-011",
          "edge_id": "edge:APPLIES_TO:01",
          "edge_type": "APPLIES_TO",
          "flags": []
        },
        {
          "from_node": "arn:aws:iam::111122223333:role/DevRole",
          "to_node": "arn:aws:iam::111122223333:role/DeployRole",
          "action_used": "sts:AssumeRole",
          "matched_rule_id": null,
          "edge_id": "edge:TRUSTED_BY:02",
          "edge_type": "TRUSTED_BY",
          "flags": [
            "trust_structural_only"
          ]
        },
        {
          "from_node": "arn:aws:iam::111122223333:role/DeployRole",
          "to_node": "arn:aws:secretsmanager:us-east-1:111122223333:secret:prod/db-password-AbCdEf",
          "action_used": "rule_target:RULE-IAM-003",
          "matched_rule_id": "RULE-IAM-003",